{
  "patient_uuid": "a2c373ec-57bf-41cb-8767-94410dcf663d",
  "document_kind": "lab_pdf",
  "document": {
    "filename": "lab-clean-001.pdf",
    "mime_type": "application/pdf",
    "sha3_512": "5414f88e0e4e92e0a0de5c6b523c99796664006ec2eb4ffeca569184df80c3537976744fa60941ee947ff67f6413f18a642e5deaba02445418d5af5223ea1ab5",
    "byte_length": 32032,
    "content_base64": "JVBERi0xLjcKJcK1wrYKJSBXcml0dGVuIGJ5IE11UERGIDEuMjguMgoKMSAwIG9iago8PC9UeXBlL0NhdGFsb2cvUGFnZXMgMiAwIFIvSW5mbzw8L1Byb2R1Y2VyKE11UERGIDEuMjguMik+Pj4+CmVuZG9iagoKMiAwIG9iago8PC9UeXBlL1BhZ2VzL0NvdW50IDEvS2lkc1s0IDAgUl0+PgplbmRvYmoKCjMgMCBvYmoKPDwvRm9udDw8L3RpYm8gNSAwIFIvaGVsdiA3IDAgUi9oZWJvIDEwIDAgUj4+Pj4KZW5kb2JqCgo0IDAgb2JqCjw8L1R5cGUvUGFnZS9NZWRpYUJveFswIDAgNjEyIDc5Ml0vUm90YXRlIDAvUmVzb3VyY2VzIDMgMCBSL1BhcmVudCAyIDAgUi9Db250ZW50c1s2IDAgUiA4IDAgUiA5IDAgUiAxMSAwIFIgMTIgMCBSIDEzIDAgUiAxNCAwIFIgMTUgMCBSIDE2IDAgUiAxNyAwIFIgMTggMCBSIDE5IDAgUiAyMCAwIFIgMjEgMCBSIDIyIDAgUiAyMyAwIFIgMjQgMCBSIDI1IDAgUiAyNiAwIFIgMjcgMCBSIDI4IDAgUiAyOSAwIFIgMzAgMCBSIDMxIDAgUiAzMiAwIFIgMzMgMCBSIDM0IDAgUiAzNSAwIFIgMzYgMCBSIDM3IDAgUiAzOCAwIFIgMzkgMCBSIDQwIDAgUiA0MSAwIFIgNDIgMCBSIDQzIDAgUiA0NCAwIFIgNDUgMCBSIDQ2IDAgUiA0NyAwIFIgNDggMCBSIDQ5IDAgUiA1MCAwIFIgNTEgMCBSIDUyIDAgUiA1MyAwIFIgNTQgMCBSIDU1IDAgUiA1NiAwIFIgNTcgMCBSIDU4IDAgUiA1OSAwIFIgNjAgMCBSIDYxIDAgUiA2MiAwIFIgNjMgMCBSIDY0IDAgUiA2NSAwIFIgNjYgMCBSIDY3IDAgUiA2OCAwIFIgNjkgMCBSIDcwIDAgUiA3MSAwIFIgNzIgMCBSIDczIDAgUiA3NCAwIFIgNzUgMCBSIDc2IDAgUiA3NyAwIFIgNzggMCBSIDc5IDAgUiA4MCAwIFIgODEgMCBSIDgyIDAgUiA4MyAwIFIgODQgMCBSIDg1IDAgUiA4NiAwIFIgODcgMCBSIDg4IDAgUiA4OSAwIFIgOTAgMCBSIDkxIDAgUiA5MiAwIFIgOTMgMCBSIDk0IDAgUiA5NSAwIFIgOTYgMCBSIDk3IDAgUiA5OCAwIFIgOTkgMCBSIDEwMCAwIFIgMTAxIDAgUiAxMDIgMCBSIDEwMyAwIFIgMTA0IDAgUiAxMDUgMCBSIDEwNiAwIFIgMTA3IDAgUiAxMDggMCBSIDEwOSAwIFIgMTEwIDAgUiAxMTEgMCBSIDExMiAwIFIgMTEzIDAgUiAxMTQgMCBSIDExNSAwIFIgMTE2IDAgUiAxMTcgMCBSIDExOCAwIFIgMTE5IDAgUiAxMjAgMCBSIDEyMSAwIFIgMTIyIDAgUiAxMjMgMCBSIDEyNCAwIFIgMTI1IDAgUiAxMjYgMCBSIDEyNyAwIFIgMTI4IDAgUiAxMjkgMCBSIDEzMCAwIFIgMTMxIDAgUiAxMzIgMCBSIDEzMyAwIFIgMTM0IDAgUiAxMzUgMCBSIDEzNiAwIFIgMTM3IDAgUiAxMzggMCBSIDEzOSAwIFIgMTQwIDAgUiAxNDEgMCBSIDE0MiAwIFIgMTQzIDAgUiAxNDQgMCBSIDE0NSAwIFIgMTQ2IDAgUiAxNDcgMCBSIDE0OCAwIFIgMTQ5IDAgUiAxNTAgMCBSIDE1MSAwIFIgMTUyIDAgUiAxNTMgMCBSIDE1NCAwIFIgMTU1IDAgUiAxNTYgMCBSIDE1NyAwIFIgMTU4IDAgUiAxNTkgMCBSIDE2MCAwIFIgMTYxIDAgUiAxNjIgMCBSIDE2MyAwIFIgMTY0IDAgUiAxNjUgMCBSIDE2NiAwIFIgMTY3IDAgUiAxNjggMCBSIDE2OSAwIFIgMTcwIDAgUiAxNzEgMCBSIDE3MiAwIFIgMTczIDAgUiAxNzQgMCBSIDE3NSAwIFIgMTc2IDAgUiAxNzcgMCBSIDE3OCAwIFIgMTc5IDAgUiAxODAgMCBSIDE4MSAwIFIgMTgyIDAgUiAxODMgMCBSXT4+CmVuZG9iagoKNSAwIG9iago8PC9UeXBlL0ZvbnQvU3VidHlwZS9UeXBlMS9CYXNlRm9udC9UaW1lcy1Cb2xkL0VuY29kaW5nL1dpbkFuc2lFbmNvZGluZz4+CmVuZG9iagoKNiAwIG9iago8PC9MZW5ndGggMTEwL0ZpbHRlci9GbGF0ZURlY29kZT4+CnN0cmVhbQp42i2KwQqDQAxE7/mK/IGb3QlWEA+CFLwpuYmXLq54KKXF/6dBZBh4vBn6Um8kHDzCCq7lwfam6jxeHxZlK9cWeH7e8Nt5aREh2sSgSeEEaAxIyGiweRME2Q2cBbW7cj190dStNtJgNNEfqrEbYwplbmRzdHJlYW0KZW5kb2JqCgo3IDAgb2JqCjw8L1R5cGUvRm9udC9TdWJ0eXBlL1R5cGUxL0Jhc2VGb250L0hlbHZldGljYS9FbmNvZGluZy9XaW5BbnNpRW5jb2Rpbmc+PgplbmRvYmoKCjggMCBvYmoKPDwvTGVuZ3RoIDk5L0ZpbHRlci9GbGF0ZURlY29kZT4+CnN0cmVhbQp42uMq5HIK4TJUMABCQwVTEwVzA1OFkFwu/YzUnDIFC4WQNAU9E1M4DnJH4RalK0TbGFsYWxgZmFiYGZobmRmZpZkbmZuZWZqZmpsDRU2AYpZAvqldbIgXl2sIVyAXAHz6GIwKZW5kc3RyZWFtCmVuZG9iagoKOSAwIG9iago8PC9MZW5ndGggMTIxL0ZpbHRlci9GbGF0ZURlY29kZT4+CnN0cmVhbQp42lWKOwoCQRBE8z5Fn0D7PzMgBoIsmCmdiZG7arAGGnh+ZxNBHhXUq4IX7BIYqcPohtEM8wnrxzR/sGLecGX+y2n4q+87njfOxaPFFFqaXIVsNBZSUlHW0Ca04BYefZXaHWuR7tUXZOxf1qp1e8kD7BOO8AWMhiBdCmVuZHN0cmVhbQplbmRvYmoKCjEwIDAgb2JqCjw8L1R5cGUvRm9udC9TdWJ0eXBlL1R5cGUxL0Jhc2VGb250L0hlbHZldGljYS1Cb2xkL0VuY29kaW5nL1dpbkFuc2lFbmNvZGluZz4+CmVuZG9iagoKMTEgMCBvYmoKPDwvTGVuZ3RoIDgwL0ZpbHRlci9GbGF0ZURlY29kZT4+CnN0cmVhbQp42uMq5HIK4TJUMABCQwVTI0s9Q0MjBXMDU4WQXC79jNSkfAULhZA0sLyBQpA7lFGUrhBtY2JskmxiaWJoZAAkTexiQ7y4XEO4ArkA5lgSAQplbmRzdHJlYW0KZW5kb2JqCgoxMiAwIG9iago8PC9MZW5ndGggODUvRmlsdGVyL0ZsYXRlRGVjb2RlPj4Kc3RyZWFtCnja4yrkcgrhMlQwAEJDBVNDIz1DSyMFM0sThZBcLv2M1JwyBQuFkDSwvIFCkDuUUZSuEG1jbGRsZGICJA2B0MLY3NjE2MAuNsSLyzWEK5ALAFRyExAKZW5kc3RyZWFtCmVuZG9iagoKMTMgMCBvYmoKPDwvTGVuZ3RoIDEwMi9GaWx0ZXIvRmxhdGVEZWNvZGU+PgpzdHJlYW0KeNrjKuRyCuEyVDAAQkMFY0sjPTMjEwUzC2OFkFwu/YzUnDIFC4WQNAU9E1M4DnJH4RalK0TbmCSbGZoZmaWZG5kZmpuAaHNLIwMTEzNLoIipmTFEzDjRLjbEi8s1hCuQCwA7BRqsCmVuZHN0cmVhbQplbmRvYmoKCjE0IDAgb2JqCjw8L0xlbmd0aCAxMDkvRmlsdGVyL0ZsYXRlRGVjb2RlPj4Kc3RyZWFtCnja4yrkcgrhMlQwAEJDBRMzcz1jQyMFMwtjhZBcLv2M1JwyBQuFkDSwvIFCkDuUUZSuEG1jkmpmaGZiZmlmaGRgkmaWZJZmlmqWaJZmlGJqZGZqbgnExkbJQLkUExO72BAvLtcQrkAuAJmsGfUKZW5kc3RyZWFtCmVuZG9iagoKMTUgMCBvYmoKPDwvTGVuZ3RoIDQzL0ZpbHRlci9GbGF0ZURlY29kZT4+CnN0cmVhbQp4nOMq5DI1UTAzN1HI5TI1tQCzcrgM9UwUyrkMFEAwyF0hmCuQCwClbwfVCmVuZHN0cmVhbQplbmRvYmoKCjE2IDAgb2JqCjw8L0xlbmd0aCA0Ni9GaWx0ZXIvRmxhdGVEZWNvZGU+PgpzdHJlYW0KeJzjKuQyNVEwM7VQMDUwUTA0UihK5crg0rNU0LM0AmJThaJ0hTSuQC4AoU0IIQplbmRzdHJlYW0KZW5kb2JqCgoxNyAwIG9iago8PC9MZW5ndGggNzcvRmlsdGVyL0ZsYXRlRGVjb2RlPj4Kc3RyZWFtCnja4yrkcgrhMlQwAEJDBVMLBTMzA4WQXC79jNSkfAULhZA0sJSBQpA7lFGUrhBtY2pgYmhqYmJpYmqSampiFxvixeUawhXIBQCXuREQCmVuZHN0cmVhbQplbmRvYmoKCjE4IDAgb2JqCjw8L0xlbmd0aCA5Ni9GaWx0ZXIvRmxhdGVEZWNvZGU+PgpzdHJlYW0KeNotibEKgDAMBfd8Rf7AtH0RBXEQRHBTsomLWHUR0f8fLCI33MHRTY2RY0k4Dl44z4XtpOyIy8UF2/Y94bH749l5qjSoQBFQYk2OXuAQgeRNPQBVX8/WU2s00Ata3RY0CmVuZHN0cmVhbQplbmRvYmoKCjE5IDAgb2JqCjw8L0xlbmd0aCA3Mi9GaWx0ZXIvRmxhdGVEZWNvZGU+PgpzdHJlYW0KeNrjKuRyCuEyVDAAQkMFUwsFMxNThZBcLv2M1JwyBQuFkDQFPaAIDAe5o3CL0hWibUxSzQzNUsxM7WJDvLhcQ7gCuQADbxKICmVuZHN0cmVhbQplbmRvYmoKCjIwIDAgb2JqCjw8L0xlbmd0aCAxMTQvRmlsdGVyL0ZsYXRlRGVjb2RlPj4Kc3RyZWFtCnjaLcoxCkJBDATQPqfICTS7SSYriIUggp2ynVj9v2qhhRae3yDymmFm6EXbToUlFS4qDHPuT1rex+PDbdG4X3+r8Gn/D+8bn9c2w6NiihWG1uRVXFEwYCjaNDSq2BwOx5Tyna0pNpd+oF2nI30BxHAb1gplbmRzdHJlYW0KZW5kb2JqCgoyMSAwIG9iago8PC9MZW5ndGggODIvRmlsdGVyL0ZsYXRlRGVjb2RlPj4Kc3RyZWFtCnja4yrkcgrhMlQwAEJDBWMjAwUzE1OFkFwu/YzUnDIFC4WQNAU9oAgMB7mjcIvSFaJtTAzNjIHQ1NzY3NjM0izNLNUuNsSLyzWEK5ALANDdFMcKZW5kc3RyZWFtCmVuZG9iagoKMjIgMCBvYmoKPDwvTGVuZ3RoIDg5L0ZpbHRlci9GbGF0ZURlY29kZT4+CnN0cmVhbQp42uMq5HIK4TJUMABCQwVjCxMFMxNThZBcLv2M1JwyBQs9C4WQNLCsgUKQO5RRlK4QbWNsZGxmbGBsYWxsbGCUYmwJhMZQ2szYyC42xIvLNYQrkAsAArUVJgplbmRzdHJlYW0KZW5kb2JqCgoyMyAwIG9iago8PC9MZW5ndGggOTAvRmlsdGVyL0ZsYXRlRGVjb2RlPj4Kc3RyZWFtCnja4yrkcgrhMlQwAEJDBVMLBTNjIz0zhZBcLv2M1JwyBQuFkDQFPRNTOA5yR+EWpStE25iYmBmam5iZGhmYpZmZAUkjM0tzI6CIhV1siBeXawhXIBcAj30WbQplbmRzdHJlYW0KZW5kb2JqCgoyNCAwIG9iago8PC9MZW5ndGggODYvRmlsdGVyL0ZsYXRlRGVjb2RlPj4Kc3RyZWFtCnja4yrkcgrhMlQwAEJDBUNjAwUzYyM9M4WQXC79jNScMgULPQuFkDSwvIFCkDuUUZSuEG1jbGhsaWxmbGCUYmxgbAkkjYxN7WJDvLhcQ7gCuQBaIhNqCmVuZHN0cmVhbQplbmRvYmoKCjI1IDAgb2JqCjw8L0xlbmd0aCA4Mi9GaWx0ZXIvRmxhdGVEZWNvZGU+PgpzdHJlYW0KeNrjKuRyCuEyVDAAQkMFYyMDBTNjIz0zhZBcLv2M1JwyBQuFkDQFPRNTOA5yR+EWpStE25gamxuYmZoZm1mapQDpVLvYEC8u1xCuQC4AzIwUvQplbmRzdHJlYW0KZW5kb2JqCgoyNiAwIG9iago8PC9MZW5ndGggNzgvRmlsdGVyL0ZsYXRlRGVjb2RlPj4Kc3RyZWFtCnja4yrkcgrhMlQwAEJDBWMLEwUzYyM9M4WQXC79jNScMgULPQuFkDSwvIFCkDuUUZSuEG1jamxmam5kbmqWYhcb4sXlGsIVyAUApj0RUwplbmRzdHJlYW0KZW5kb2JqCgoyNyAwIG9iago8PC9MZW5ndGggNzMvRmlsdGVyL0ZsYXRlRGVjb2RlPj4Kc3RyZWFtCnja4yrkcgrhMlQwAEJDBVMLBTMjAz0jhZBcLv2M1JwyBQuFkDQFPRNTOA5yR+EWpStE25gam5maW9jFhnhxuYZwBXIBAPfdEh4KZW5kc3RyZWFtCmVuZG9iagoKMjggMCBvYmoKPDwvTGVuZ3RoIDgwL0ZpbHRlci9GbGF0ZURlY29kZT4+CnN0cmVhbQp42uMq5HIK4TJUMABCQwVDYwMFMyMDPSOFkFwu/YzUnDIFCz0LhZA0sLyBQpA7lFGUrhBtY2JmZmqWYmZolmxmahcb4sXlGsIVyAUAx7YR2QplbmRzdHJlYW0KZW5kb2JqCgoyOSAwIG9iago8PC9MZW5ndGggODMvRmlsdGVyL0ZsYXRlRGVjb2RlPj4Kc3RyZWFtCnja4yrkcgrhMlQwAEJDBWMjAwUzIwM9I4WQXC79jNScMgULhZA0BT0TUzgOckfhFqUrRNuYGJulmSUDoamZsbkJkDSxiw3x4nIN4QrkAgD7UxVNCmVuZHN0cmVhbQplbmRvYmoKCjMwIDAgb2JqCjw8L0xlbmd0aCA5NC9GaWx0ZXIvRmxhdGVEZWNvZGU+PgpzdHJlYW0KeNrjKuRyCuEyVDAAQkMFYwsTBTMjAz0jhZBcLv2M1JwyBQs9C4WQNLC8gUKQO5RRlK4QbWNsZGwAxGZGKUDaAkgaGxsYGQDZ5saJxobGRnaxIV5criFcgVwAUecV7wplbmRzdHJlYW0KZW5kb2JqCgozMSAwIG9iago8PC9MZW5ndGggNzEvRmlsdGVyL0ZsYXRlRGVjb2RlPj4Kc3RyZWFtCnja4yrkcgrhMlQwAEJDBVMLBTMDcz0LhZBcLv2M1JwyBSAzTUHPxBSOg9xRuEXpCtE2JimmRiapdrEhXlyuIVyBXAD/ChJ/CmVuZHN0cmVhbQplbmRvYmoKCjMyIDAgb2JqCjw8L0xlbmd0aCA3MC9GaWx0ZXIvRmxhdGVEZWNvZGU+PgpzdHJlYW0KeNrjKuRyCuEyVDAAQkMFQ2MDBTMDcz0LhZBcLv2M1JwyBQsQJw0sb6AQ5A5lFKUrRNsYGxtb2MWGeHG5hnAFcgEAP7EP2wplbmRzdHJlYW0KZW5kb2JqCgozMyAwIG9iago8PC9MZW5ndGggNzkvRmlsdGVyL0ZsYXRlRGVjb2RlPj4Kc3RyZWFtCnja4yrkcgrhMlQwAEJDBWMjAwUzA3M9C4WQXC79jNScMgUgM01Bz8QUjoPcUbhF6QrRNqZGZqZmxkBsaW4GJE3sYkO8uFxDuAK5AMk2FGYKZW5kc3RyZWFtCmVuZG9iagoKMzQgMCBvYmoKPDwvTGVuZ3RoIDkxL0ZpbHRlci9GbGF0ZURlY29kZT4+CnN0cmVhbQp42uMq5HIK4TJUMABCQwVjCxMFMwNzPQuFkFwu/YzUnDIFCxAnDSxvoBDkDmUUpStE2xgbGRsAsZlRCpC2AJLGxgZGBkC2pXEiUNzSLjbEi8s1hCuQCwBV2xYECmVuZHN0cmVhbQplbmRvYmoKCjM1IDAgb2JqCjw8L0xlbmd0aCA4MS9GaWx0ZXIvRmxhdGVEZWNvZGU+PgpzdHJlYW0KeNrjKuRyCuEyVDAAQkMFUwsFU0tTPROFkFwu/YzUnDIFC4WQNAU9E1M4DnJH4RalK0TbmBiamZiZmBuZmZobmxvbxYZ4cbmGcAVyAQCR5RPKCmVuZHN0cmVhbQplbmRvYmoKCjM2IDAgb2JqCjw8L0xlbmd0aCA5NC9GaWx0ZXIvRmxhdGVEZWNvZGU+PgpzdHJlYW0KeNrjKuRyCuEyVDAAQkMFQ2MDBVNLUz0ThZBcLv2M1JwyBQs9C4WQNLC8gUKQO5RRlK4QbWNsYWxpbGBkYJJiZmmWbJZsbmxkYGpuZgpi28WGeHG5hnAFcgEACEAVtgplbmRzdHJlYW0KZW5kb2JqCgozNyAwIG9iago8PC9MZW5ndGggODQvRmlsdGVyL0ZsYXRlRGVjb2RlPj4Kc3RyZWFtCnja4yrkcgrhMlQwAEJDBWMjAwVTS1M9E4WQXC79jNScMgULhZA0BT0TUzgOckfhFqUrRNuYGpmZmhuYpZkbmZuYmZqZ2MWGeHG5hnAFcgEAzNQUjwplbmRzdHJlYW0KZW5kb2JqCgozOCAwIG9iago8PC9MZW5ndGggOTQvRmlsdGVyL0ZsYXRlRGVjb2RlPj4Kc3RyZWFtCnja4yrkcgrhMlQwAEJDBWMLEwVTS1M9E4WQXC79jNScMgULPQuFkDSwvIFCkDuUUZSuEG1jbGRsAMRmRilA2gJIGhsbGBkYGxqbGScCxS3tYkO8uFxDuAK5AFZuFgQKZW5kc3RyZWFtCmVuZG9iagoKMzkgMCBvYmoKPDwvTGVuZ3RoIDExMC9GaWx0ZXIvRmxhdGVEZWNvZGU+PgpzdHJlYW0KeNrjKuRyCuEyVDAAQkMFQ2MDBVMLY4WQXC79jNScMgULPQuFkDSwrIFCkDuUUZSuEG1jam5mam5sbmJubpYGhCZGyUYGJilmhkAxYzNDM2MzC3OgPFCNCRAaGxkYw6FdbIgXl2sIVyAXALZ6Gz0KZW5kc3RyZWFtCmVuZG9iagoKNDAgMCBvYmoKPDwvTGVuZ3RoIDg0L0ZpbHRlci9GbGF0ZURlY29kZT4+CnN0cmVhbQp42uMq5HIK4TJUMABCQwVjIwMFUwtjhZBcLv2M1JwyBQuFkDQFPRNTOA5yR+EWpStE25ikmRuZmZiZAklTMxMjAzMjc0u72BAvLtcQrkAuAPsCFPwKZW5kc3RyZWFtCmVuZG9iagoKNDEgMCBvYmoKPDwvTGVuZ3RoIDEwMC9GaWx0ZXIvRmxhdGVEZWNvZGU+PgpzdHJlYW0KeNrjKuRyCuEyVDAAQkMFYwsTBVMLY4WQXC79jNScMgULPQuFkDSwrIFCkDuUUZSuEG1jkmJmaG5kZmxuam5sZGCSZm5pZmqWDBYzNEs1SgaKpZiY2MWGeHG5hnAFcgEAxeYXkgplbmRzdHJlYW0KZW5k